{
  "task_id": "t",
  "issue": "ORV-81",
  "pr": 1,
  "verdict": "approve",
  "head_sha": "aaaaaaaaaaaaaaaaaaaaaaaaaaaaaaaaaaaaaaaa",
  "quality_gate": {
    "report": ".quality-gate/report.json",
    "ok": true,
    "head_sha": "aaaaaaaaaaaaaaaaaaaaaaaaaaaaaaaaaaaaaaaa"
  },
  "ac": [
    {
      "row": 1,
      "status": "pass",
      "visual": true,
      "evidence": [
        {
          "kind": "computed_style",
          "ref": "story a b",
          "observed": "4px"
        }
      ]
    }
  ],
  "screenshots": [
    {
      "story": "components-checkbox--default",
      "mode": "light",
      "path": ".orivilo/runs/ORV-81/t/screenshots/components-checkbox--default-light.png",
      "looked_at": true,
      "note": "glyph centred"
    },
    {
      "story": "components-checkbox--default",
      "mode": "dark",
      "path": ".orivilo/runs/ORV-81/t/screenshots/components-checkbox--default-dark.png",
      "looked_at": true,
      "note": "glyph centred"
    }
  ],
  "findings": []
}
